URL: https://www.runoob.com/postgresql/postgresql-transaction.html
Title: PostgreSQL TRANSACTION（事务） | 菜鸟教程

PostgreSQL TRANSACTION（事务） | 菜鸟教程 

菜鸟教程 -- 学的不仅是技术，更是梦想！ 

PostgreSQL 教程 

PostgreSQL View（视图） 

PostgreSQL LOCK（锁） 

PostgreSQL TRANSACTION（事务） 

TRANSACTION（事务）是数据库管理系统执行过程中的一个逻辑单位，由一个有限的数据库操作序列构成。 

数据库事务通常包含了一个序列的对数据库的读/写操作。包含有以下两个目的： 

为数据库操作序列提供了一个从失败中恢复到正常状态的方法，同时提供了数据库即使在异常状态下仍能保持一致性的方法。 

当多个应用程序在并发访问数据库时，可以在这些应用程序之间提供一个隔离方法，以防止彼此的操作互相干扰。 

当事务被提交给了数据库管理系统（DBMS），则 DBMS 需要确保该事务中的所有操作都成功完成且其结果被永久保存在数据库中，如果事务中有的操作没有成功完成，则事务中的所有操作都需要回滚，回到事务执行前的状态；同时，该事务对数据库或者其他事务的执行无影响，所有的事务都好像在独立的运行。 

事务的属性 

事务具有以下四个标准属性，通常根据首字母缩写为 ACID： 

原子性（Atomicity）：事务作为一个整体被执行，包含在其中的对数据库的操作要么全部被执行，要么都不执行。 

一致性（Consistency）：事务应确保数据库的状态从一个一致状态转变为另一个一致状态。一致状态的含义是数据库中的数据应满足完整性约束。 

隔离性（Isolation）：多个事务并发执行时，一个事务的执行不应影响其他事务的执行。 

持久性（Durability）：已被提交的事务对数据库的修改应该永久保存在数据库中。 

例子 

某人要在商店使用电子货币购买100元的东西，当中至少包括两个操作： 

该人账户减少 100 元。 

商店账户增加100元。 

支持事务的数据库管理系统就是要确保以上两个操作（整个"事务"）都能完成，或一起取消，否则就会出现 100 元平白消失或出现的情况。 

事务控制 

使用下面的命令来控制事务： 

BEGIN TRANSACTION ：开始一个事务。 

COMMIT ：事务确认，或者可以使用 END TRANSACTION 命令。 

ROLLBACK ：事务回滚。 

事务控制命令只与 INSERT、UPDATE 和 DELETE 一起使用。他们不能在创建表或删除表时使用，因为这些操作在数据库中是自动提交的。 

BEGIN TRANSACTION 命令 

事务可以使用 BEGIN TRANSACTION 命令或简单的 BEGIN 命令来启动。此类事务通常会持续执行下去，直到遇到下一个 COMMIT 或 ROLLBACK 命令。不过在数据库关闭或发生错误时，事务处理也会回滚。以下是启动一个事务的简单语法： 

BEGIN;

或者

BEGIN TRANSACTION; 

COMMIT 命令 

COMMIT 命令是用于把事务调用的更改保存到数据库中的事务命令，即确认事务。 

COMMIT 命令的语法如下： 

COMMIT;

或者

END TRANSACTION; 

ROLLBACK 命令 

ROLLBACK 命令是用于撤消尚未保存到数据库的事务命令，即回滚事务。 

ROLLBACK 命令的语法如下： 

ROLLBACK; 

实例 

创建 COMPANY 表（ 下载 COMPANY SQL 文件 ），数据内容如下： 

runoobdb# select * from COMPANY;
 id | name | age | address | salary
----+-------+-----+-----------+--------
 1 | Paul | 32 | California| 20000
 2 | Allen | 25 | Texas | 15000
 3 | Teddy | 23 | Norway | 20000
 4 | Mark | 25 | Rich-Mond | 65000
 5 | David | 27 | Texas | 85000
 6 | Kim | 22 | South-Hall| 45000
 7 | James | 24 | Houston | 10000
(7 rows) 

现在，让我们开始一个事务，并从表中删除 age = 25 的记录，最后，我们使用 ROLLBACK 命令撤消所有的更改。 

runoobdb=# BEGIN;
DELETE FROM COMPANY WHERE AGE = 25;
ROLLBACK; 

检查 COMPANY 表，仍然有以下记录： 

id | name | age | address | salary
----+-------+-----+-----------+--------
 1 | Paul | 32 | California| 20000
 2 | Allen | 25 | Texas | 15000
 3 | Teddy | 23 | Norway | 20000
 4 | Mark | 25 | Rich-Mond | 65000
 5 | David | 27 | Texas | 85000
 6 | Kim | 22 | South-Hall| 45000
 7 | James | 24 | Houston | 10000 

现在，让我们开始另一个事务，从表中删除 age = 25 的记录，最后我们使用 COMMIT 命令提交所有的更改。 

runoobdb=# BEGIN;
DELETE FROM COMPANY WHERE AGE = 25;
COMMIT; 

检查 COMPANY 表，记录已被删除： 

id | name | age | address | salary
----+-------+-----+------------+--------
 1 | Paul | 32 | California | 20000
 3 | Teddy | 23 | Norway | 20000
 5 | David | 27 | Texas | 85000
 6 | Kim | 22 | South-Hall | 45000
 7 | James | 24 | Houston | 10000
(5 rows) 

AI 思考中... 

PostgreSQL View（视图） 

PostgreSQL LOCK（锁）
