URL: https://www.runoob.com/postgresql/postgresql-delete.html
Title: PostgreSQL DELETE 语句 | 菜鸟教程

PostgreSQL DELETE 语句 | 菜鸟教程 

菜鸟教程 -- 学的不仅是技术，更是梦想！ 

PostgreSQL 教程 

PostgreSQL UPDATE 语句 

PostgreSQL LIKE 子句 

PostgreSQL DELETE 语句 

你可以使用 DELETE 语句来删除 PostgreSQL 表中的数据。 

语法 

以下是 DELETE 语句删除数据的通用语法： 

DELETE FROM table_name WHERE [condition]; 

如果没有指定 WHERE 子句，PostgreSQL 表中的所有记录将被删除。 

一般我们需要在 WHERE 子句中指定条件来删除对应的记录，条件语句可以使用 AND 或 OR 运算符来指定一个或多个。 

实例 

创建 COMPANY 表（ 下载 COMPANY SQL 文件 ），数据内容如下： 

runoobdb# select * from COMPANY;
 id | name | age | address | salary
----+-------+-----+-----------+--------
 1 | Paul | 32 | California| 20000
 2 | Allen | 25 | Texas | 15000
 3 | Teddy | 23 | Norway | 20000
 4 | Mark | 25 | Rich-Mond | 65000
 5 | David | 27 | Texas | 85000
 6 | Kim | 22 | South-Hall| 45000
 7 | James | 24 | Houston | 10000
(7 rows) 

以下 SQL 语句将删除 ID 为 2 的数据： 

runoobdb=# DELETE FROM COMPANY WHERE ID = 2; 

得到结果如下： 

id | name | age | address | salary
----+-------+-----+-------------+--------
 1 | Paul | 32 | California | 20000
 3 | Teddy | 23 | Norway | 20000
 4 | Mark | 25 | Rich-Mond | 65000
 5 | David | 27 | Texas | 85000
 6 | Kim | 22 | South-Hall | 45000
 7 | James | 24 | Houston | 10000
(6 rows) 

从上面结果可以看出，id 为 2 的数据已被删除。 

以下语句将删除整张 COMPANY 表： 

DELETE FROM COMPANY; 

AI 思考中... 

PostgreSQL UPDATE 语句 

PostgreSQL LIKE 子句
